Ad type,Ad Group,Campaign,Final URL,Headline 1,Headline 2,Headline 3,Headline 4,Headline 5,Headline 6,Headline 7,Headline 8,Headline 9,Headline 10,Headline 11,Headline 12,Headline 13,Headline 14,Headline 15,Description 1,Description 2,Description 3,Description 4,Path 1,Path 2,Status,Labels
Responsive search ad,"WebP to PNG - General","ConvertMyFile - WebP to PNG - AU",https://convertmyfile.com/webp-to-png,"WebP to PNG Converter","Convert WebP Images Free","Online WebP Converter","Fast WebP to PNG","Free Image Converter","WebP to PNG Online","Convert WebP Files","Quick WebP Conversion","Best WebP Converter","WebP to PNG Tool","Easy WebP Convert","Professional Converter","No Software Needed","Instant Conversion","Free Online Tool","Convert WebP to PNG instantly with our free online converter. No software installation required.","Fast, secure WebP to PNG conversion. Upload your WebP files and download PNG images in seconds.","Professional quality image conversion. Maintain image quality while converting WebP to PNG format.","Trusted by thousands of users. Free, fast, and secure WebP to PNG conversion online.",webp-to-png,converter,Enabled,LBA_SEO_ADS_EXPERT_2025-01-07
Responsive search ad,"WebP to PNG - Photography","ConvertMyFile - WebP to PNG - AU",https://convertmyfile.com/webp-to-png,"WebP to PNG for Photos","Photography Converter","Convert WebP Photos","Professional Image Tool","Photographer's Choice","High Quality Convert","Photo Format Converter","WebP Photography Tool","Convert Photo Files","Image Format Tool","Pro Photo Converter","Photography WebP Tool","Studio Quality Convert","Photo WebP to PNG","Professional Photos","Convert WebP photos to PNG with professional quality. Perfect for photographers and designers.","Maintain image quality and metadata. Professional WebP to PNG conversion for photography.","Trusted by professional photographers. Convert WebP images while preserving quality.","Studio-quality WebP to PNG conversion. Perfect for professional photography workflows.",webp-to-png,photography,Enabled,LBA_SEO_ADS_EXPERT_2025-01-07
Responsive search ad,"HEIC to JPG - iPhone Users","ConvertMyFile - HEIC to JPG - AU",https://convertmyfile.com/heic-to-jpg,"HEIC to JPG Converter","iPhone Photo Converter","Convert iPhone Photos","HEIC to JPEG Free","iOS Photo Converter","iPhone HEIC Convert","Apple Photo Convert","Convert HEIC Files","iPhone Image Tool","HEIC Photo Converter","iOS to JPG Tool","iPhone Format Convert","Apple HEIC to JPG","Quick HEIC Convert","Free iPhone Tool","Convert iPhone HEIC photos to JPG instantly. Perfect for sharing iPhone photos anywhere.","Easy HEIC to JPG conversion for iPhone users. Share your photos on any platform.","Convert Apple HEIC format to universal JPG. Compatible with all devices and platforms.","Free iPhone photo converter. Transform HEIC files to JPG in seconds online.",heic-to-jpg,iphone,Enabled,LBA_SEO_ADS_EXPERT_2025-01-07
Responsive search ad,"PDF to JPG - Business","ConvertMyFile - PDF to JPG - AU",https://convertmyfile.com/pdf-to-jpg,"PDF to JPG Converter","Business PDF Tool","Convert PDF Documents","Professional PDF Convert","Business Document Tool","PDF to Image Pro","Corporate PDF Tool","Convert Business PDFs","Enterprise PDF Convert","Document Converter Pro","Business Image Extract","PDF Page to JPG","Professional Document","Quick PDF Convert","Business Solution","Professional PDF to JPG conversion for business. Extract images from PDF documents instantly.","Convert PDF pages to high-quality JPG images. Perfect for presentations and reports.","Business-grade PDF to image conversion. Secure, fast, and professional results.","Enterprise PDF converter trusted by businesses. Convert PDFs to JPG with confidence.",pdf-to-jpg,business,Enabled,LBA_SEO_ADS_EXPERT_2025-01-07
Responsive search ad,"WebP to PNG - General","ConvertMyFile - WebP to PNG - US",https://convertmyfile.com/webp-to-png,"WebP to PNG Converter","Convert WebP Online","Free WebP Converter","Quick WebP to PNG","Online Image Convert","WebP File Converter","Fast PNG Conversion","WebP to PNG Free","Best WebP Tool","Convert WebP Images","Easy WebP to PNG","No Download Needed","Instant WebP Convert","Free Conversion Tool","Simple WebP Convert","Free WebP to PNG converter online. No registration or software download required.","Convert WebP files to PNG format quickly and easily. 100% free online tool.","Fast and secure WebP to PNG conversion. Upload, convert, and download in seconds.","The easiest way to convert WebP to PNG. Free, fast, and works on any device.",webp-to-png,free,Enabled,LBA_SEO_ADS_EXPERT_2025-01-07
Responsive search ad,"HEIC to JPG - iPhone Users","ConvertMyFile - HEIC to JPG - US",https://convertmyfile.com/heic-to-jpg,"HEIC to JPG Converter","iPhone Photo Convert","Convert HEIC Free","iOS Photo to JPG","Apple HEIC Converter","iPhone Image Convert","HEIC to JPEG Tool","Convert iPhone HEIC","Free HEIC Converter","iOS Photo Tool","Apple Photo Convert","HEIC File Converter","iPhone to JPG","Quick HEIC Tool","Easy iPhone Convert","Convert iPhone HEIC photos to JPG for free. Share your photos anywhere online.","Simple HEIC to JPG conversion for iPhone and iPad users. Works on any device.","Transform Apple HEIC files to standard JPG format. Free and easy to use.","The best free HEIC to JPG converter for iPhone photos. No app download needed.",heic-to-jpg,free,Enabled,LBA_SEO_ADS_EXPERT_2025-01-07